	Fund Manager(s)	Company Name	Region	Sub-Region	Country	country code	country code_2	ICB Industry	ICB Supersector	ICB Sector	ICB Subsector	GICS Industry [column F]	IFC primary sector	IFC primary sector (#)	Asset Class	Investment Type	Investment Amount (US$m)	Investment Date	year	IFC	valuation
3711	Infuse Ventures	Green India Building Systems and Services (GIBSS)	Asia	South Asia	India	IND	IN	Industrials	Industrial Goods & Services	Support Services	Business Support Services	Commercial Services & Supplies	R Professional, Scientific and Technical Services	Professional, Scientific and Technical Services	Private Equity	Growth		15-Apr	2015	0.0	
3712	Bessemer Venture Partners, Blume Ventures	Manak Waste Management (Cashify)	Asia	South Asia	India	IND	IN	Consumer Services	Retail	General Retailers	Specialty Retailers	Specialty Retail	Q Wholesale and Retail Trade	Wholesale and Retail Trade	Private Equity	Venture Capital		15-Apr	2015	0.0	
3713	DGF Investimentos	Mercado Eletronico	Latin America	South America	Brazil	BRA	BR	Industrials	Industrial Goods & Services	Support Services	Financial Administration	Commercial Services & Supplies	R Professional, Scientific and Technical Services	Professional, Scientific and Technical Services	Private Equity	Growth	10	15-Apr	2015	0.0	
3714	Yunfeng Capital, New Horizon Capital, Shenzhen Cowin Venture Capital	Shenzhen Huakang Quanjing Information Technology (Huakang Mobile Healthcare)	Asia	East Asia	China	CHN	CN	Consumer Services	Retail	General Retailers	Specialized Consumer Services	Specialty Retail	Q Wholesale and Retail Trade	Wholesale and Retail Trade	Private Equity	Venture Capital	32	15-Apr	2015	0.0	
3715	Inovo Venture Capital	MyLED	CEE & CIS	Central & Eastern Europe (CEE)	Poland	POL	PL	Consumer Goods	Personal & Household Goods	Household Goods & Home Construction	Durable Household Products	Household Durables	M Industrial & Consumer Products	Industrial & Consumer Products	Private Equity	Venture Capital	0.3	15-Apr	2015	0.0	
3716	LeapFrog Investments	Reliance Capital Management	Asia	Southeast Asia	Indonesia	IDN	ID	Financials	Financial Services	Financial Services	Asset Managers	Capital Markets	P Collective Investment Vehicles	Collective Investment Vehicles	Private Equity	Growth	37	15-Apr	2015	0.0	
3717	SparkLabs Global Ventures	DocDoc	Asia	Southeast Asia	Singapore	SGP	SG	Consumer Services	Retail	General Retailers	Specialized Consumer Services	Specialty Retail	Q Wholesale and Retail Trade	Wholesale and Retail Trade	Private Equity	Venture Capital	9	15-Apr	2015	0.0	
3718	Omnivore Capital Management Advisors	Y-Cook	Asia	South Asia	India	IND	IN	Consumer Goods	Food & Beverage	Food Producers	Food Products	Food Products	F Food & Beverages	Food & Beverages	Private Equity	Growth		15-Apr	2015	0.0	
3719	Platinum Equity	Ying Shing Enterprises	Asia	East Asia	China	CHN	CN	Industrials	Industrial Goods & Services	Support Services	Industrial Suppliers	Commercial Services & Supplies	R Professional, Scientific and Technical Services	Professional, Scientific and Technical Services	Private Equity	Buyout		15-Apr	2015	0.0	
3720	GMO Venture Partners	2C2P	Asia	Southeast Asia	Singapore	SGP	SG	Industrials	Industrial Goods & Services	Support Services	Financial Administration	Commercial Services & Supplies	R Professional, Scientific and Technical Services	Professional, Scientific and Technical Services	Private Equity	Venture Capital	7	15-Apr	2015	0.0	
3721	IDG Capital Partners (IDGVC)	Dmall	Asia	East Asia	China	CHN	CN	Industrials	Industrial Goods & Services	Industrial Transportation	Delivery Services	Air Freight & Logistics	E Transportation and Warehousing	Transportation and Warehousing	Private Equity	Venture Capital		15-Apr	2015	0.0	
3722	e.Bricks Digital, 500 Startups	YContent (formerly Samba Ads)	Latin America	South America	Brazil	BRA	BR	Consumer Services	Media	Media	Media Agencies	Media	N Information	Information	Private Equity	Venture Capital	1	15-Apr	2015	0.0	
3723	Accel Partners, SAIF Partners	Coverfox Insurance Broking	Asia	South Asia	India	IND	IN	Financials	Insurance	Nonlife Insurance	Insurance Brokers	Insurance	O Finance & Insurance	Finance & Insurance	Private Equity	Venture Capital	12	15-Apr	2015	0.0	
3724	Equis	Energon Soleq	Asia	South Asia	India	IND	IN	Utilities	Utilities	Electricity	Alternative Electricity	Independent Power and Renewable Electricity Producers	V Electric Power	Utilities	Infrastructure & Real Assets	Growth		15-Apr	2015	0.0	
3725	Lightspeed Venture Partners	Phone Warrior	Asia	South Asia	India	IND	IN	Technology	Technology	Software & Computer Services	Software	Software	R Professional, Scientific and Technical Services	Professional, Scientific and Technical Services	Private Equity	Venture Capital	0.5	15-Apr	2015	0.0	
3726	Sequoia Capital, Global Founders Capital, Lightspeed Venture Partners, Nexus Venture Partners	Kribha Handicrafts (Craftsvilla)	Asia	South Asia	India	IND	IN	Consumer Services	Retail	General Retailers	Broadline Retailers	Specialty Retail	Q Wholesale and Retail Trade	Wholesale and Retail Trade	Private Equity	Venture Capital	17	15-Apr	2015	0.0	
3727	Advanced Finance and Investment Group	Primrose Properties Ghana	Sub-Saharan Africa	West Africa	Ghana	GHA	GH	Financials	Real Estate	Real Estate Investment & Services	Real Estate Holding & Development	Real Estate Management & Development	D Construction and Real Estate	Construction and Real Estate	Private Equity	Growth		15-Apr	2015	1.0	
3728	Meridian Capital	Sweetie Salad	Asia	East Asia	China	CHN	CN	Consumer Services	Retail	Food & Drug Retailers	Food Retailers & Wholesalers	Food & Staples Retailing	Q Wholesale and Retail Trade	Wholesale and Retail Trade	Private Equity	Venture Capital		15-Apr	2015	0.0	
3729	Verod Capital Management	Union Trustees	Sub-Saharan Africa	West Africa	Nigeria	NGA	NG	Financials	Financial Services	Financial Services	Asset Managers	Capital Markets	P Collective Investment Vehicles	Collective Investment Vehicles	Private Equity	Buyout		15-Apr	2015	0.0	
3730	The Osiris Group	SureCash	Asia	South Asia	Bangladesh	BGD	BD	Financials	Financial Services	Financial Services	Consumer Finance	Consumer Finance	O Finance & Insurance	Finance & Insurance	Private Equity	Venture Capital	7	15-Apr	2015	0.0	
3731	Lok Capital	SEWA Grih Rin (SGR)	Asia	South Asia	India	IND	IN	Financials	Financial Services	Financial Services	Specialty Finance	Diversified Financial Services	O Finance & Insurance	Finance & Insurance	Private Equity	Growth	2	15-Apr	2015	1.0	
3732	CMC Capital Partners	International Program Content Network (IPCN)	Asia	East Asia	China	CHN	CN	Consumer Services	Media	Media	Publishing	Media	N Information	Information	Private Equity	Growth		15-Apr	2015	0.0	
3733	Nova Founders Capital	Compare Asia Group	Asia	East Asia	China	CHN	CN	Financials	Financial Services	Financial Services	Consumer Finance	Consumer Finance	O Finance & Insurance	Finance & Insurance	Private Equity	Venture Capital		15-Apr	2015	0.0	
3734	Keytone Ventures, Morningside Ventures	Chemayi	Asia	East Asia	China	CHN	CN	Consumer Services	Retail	General Retailers	Specialized Consumer Services	Specialty Retail	Q Wholesale and Retail Trade	Wholesale and Retail Trade	Private Equity	Venture Capital	20	15-Apr	2015	0.0	
3735	Matrix Partners	MAKA	Asia	East Asia	China	CHN	CN	Technology	Technology	Software & Computer Services	Internet	Internet Software & Services	N Information	Information	Private Equity	Venture Capital	2	15-Apr	2015	0.0	
3736	Hony Capital	Forever Top (Asia)	Asia	East Asia	China	CHN	CN	Consumer Services	Media	Media	Broadcasting & Entertainment	Media	N Information	Information	Private Equity	Growth		15-Apr	2015	0.0	
3737	Matrix Partners	Beijing Zhiguo Technology (Zhiguoguo)	Asia	East Asia	China	CHN	CN	Industrials	Industrial Goods & Services	Support Services	Business Support Services	Commercial Services & Supplies	R Professional, Scientific and Technical Services	Professional, Scientific and Technical Services	Private Equity	Venture Capital	4	15-Apr	2015	0.0	
3738	Northstar Group, Jungle Ventures	TradeGecko	Asia	Southeast Asia	Singapore	SGP	SG	Technology	Technology	Software & Computer Services	Software	Software	R Professional, Scientific and Technical Services	Professional, Scientific and Technical Services	Private Equity	Venture Capital	7	15-Apr	2015	0.0	
3739	Fenox Venture Capital, 500 Startups, Golden Gate Ventures	Alodokter	Asia	Southeast Asia	Indonesia	IDN	ID	Consumer Services	Media	Media	Publishing	Media	N Information	Information	Private Equity	Venture Capital		15-Apr	2015	0.0	
3740	Norwest Venture Partners (NVP)	Sulekha.com	Asia	South Asia	India	IND	IN	Consumer Services	Media	Media	Media Agencies	Media	N Information	Information	Private Equity	Venture Capital		15-Apr	2015	0.0	
3741	Meridian Capital	Weimob	Asia	East Asia	China	CHN	CN	Technology	Technology	Software & Computer Services	Software	Software	R Professional, Scientific and Technical Services	Professional, Scientific and Technical Services	Private Equity	Venture Capital		15-Apr	2015	0.0	
3742	China Renaissance Capital Investment (CRCI), GL Capital Management	China Traditional Chinese Medicine (China TCM)	Asia	East Asia	China	CHN	CN	Health Care	Health Care	Pharmaceuticals & Biotechnology	Pharmaceuticals	Pharmaceuticals	G Chemicals	Chemicals	Private Equity	PIPE	63	15-Apr	2015	0.0	
3743	Banyan Capital	Beijing Caihong Lexiang Information Technology (Diandao)	Asia	East Asia	China	CHN	CN	Consumer Services	Retail	General Retailers	Specialized Consumer Services	Specialty Retail	Q Wholesale and Retail Trade	Wholesale and Retail Trade	Private Equity	Venture Capital	5	15-Apr	2015	0.0	
3744	Matrix Partners, Shunwei Capital Partners, Ventech	Jimubox.com	Asia	East Asia	China	CHN	CN	Financials	Financial Services	Financial Services	Consumer Finance	Consumer Finance	O Finance & Insurance	Finance & Insurance	Private Equity	Venture Capital		15-Apr	2015	0.0	
3745	Sequoia Capital, Kae Capital	Bright Lifecare (1MG Technologies)	Asia	South Asia	India	IND	IN	Consumer Services	Retail	Food & Drug Retailers	Drug Retailers	Food & Staples Retailing	Q Wholesale and Retail Trade	Wholesale and Retail Trade	Private Equity	Venture Capital	6	15-Apr	2015	0.0	
3746	CITIC Capital Partners	China Zhongdi Dairy Holdings	Asia	East Asia	China	CHN	CN	Consumer Goods	Food & Beverage	Food Producers	Food Products	Food Products	F Food & Beverages	Food & Beverages	Private Equity	Growth		15-Apr	2015	0.0	
3747	SAIF Partners, Sequoia Capital	Nuvo Logistics (PepperTap)	Asia	South Asia	India	IND	IN	Consumer Services	Retail	General Retailers	Specialized Consumer Services	Specialty Retail	Q Wholesale and Retail Trade	Wholesale and Retail Trade	Private Equity	Venture Capital	10	15-Apr	2015	0.0	
3748	China Broadband Capital (CBC), Gobi Partners	Kalading	Asia	East Asia	China	CHN	CN	Industrials	Industrial Goods & Services	Industrial Transportation	Transportation Services	Transportation Infrastructure	E Transportation and Warehousing	Transportation and Warehousing	Private Equity	Venture Capital	10	15-Apr	2015	0.0	
3749	GRC SinoGreen, IDG Capital Partners (IDGVC), Pangaea Ventures, WI Harper Group	CNano Technology	Asia	East Asia	China	CHN	CN	Industrials	Industrial Goods & Services	Electronic & Electrical Equipment	Electrical Components & Equipment	Electrical Equipment	M Industrial & Consumer Products	Industrial & Consumer Products	Private Equity	Venture Capital	15	15-Apr	2015	1.0	
3750	BlueRun Ventures	Beijing Mazhan Brothers Technology	Asia	East Asia	China	CHN	CN	Financials	Financial Services	Financial Services	Investment Services	Capital Markets	O Finance & Insurance	Finance & Insurance	Private Equity	Venture Capital	10	15-Apr	2015	0.0	
3751	Vision Knight Capital Partners	Zhong Ao Home Group	Asia	East Asia	China	CHN	CN	Financials	Real Estate	Real Estate Investment & Services	Real Estate Services	Real Estate Management & Development	D Construction and Real Estate	Construction and Real Estate	Private Equity	Growth	20	15-Apr	2015	0.0	
3752	DCM	Udesk	Asia	East Asia	China	CHN	CN	Technology	Technology	Software & Computer Services	Computer Services	IT Services	R Professional, Scientific and Technical Services	Professional, Scientific and Technical Services	Private Equity	Venture Capital	3	15-Apr	2015	0.0	
3753	Ascent Capital India, Kalaari Capital	Robosoft Technologies	Asia	South Asia	India	IND	IN	Consumer Goods	Personal & Household Goods	Leisure Goods	Toys	Specialty Retail	M Industrial & Consumer Products	Industrial & Consumer Products	Private Equity	Venture Capital	12	15-Apr	2015	0.0	
3754	DST Global, Accel Partners, Tiger Global Management	ANI Technologies (Ola)	Asia	South Asia	India	IND	IN	Consumer Services	Travel & Leisure	Travel & Leisure	Travel & Tourism	Hotels, Restaurants & Leisure	U Accommodation & Tourism Services	Accommodation & Tourism Services	Private Equity	Venture Capital	252	15-Apr	2015	0.0	
3755	Softbank China Venture Capital (SBCVC)	G-Banker.com	Asia	East Asia	China	CHN	CN	Financials	Financial Services	Financial Services	Investment Services	Capital Markets	O Finance & Insurance	Finance & Insurance	Private Equity	Venture Capital	10	15-Apr	2015	1.0	
3756	Aavishkaar Venture Management	Connect India	Asia	South Asia	India	IND	IN	Industrials	Industrial Goods & Services	Industrial Transportation	Transportation Services	Transportation Infrastructure	E Transportation and Warehousing	Transportation and Warehousing	Private Equity	Growth	5	15-Apr	2015	0.0	
3757	Sequoia Capital, Shunwei Capital Partners, WestSummit Capital	Ninebot	Asia	East Asia	China	CHN	CN	Consumer Goods	Personal & Household Goods	Leisure Goods	Recreational Products	Specialty Retail	M Industrial & Consumer Products	Industrial & Consumer Products	Private Equity	Venture Capital	80	15-Apr	2015	0.0	
3758	Tiger Global Management, Sequoia Capital	Locodel Solutions (Grofers)	Asia	South Asia	India	IND	IN	Industrials	Industrial Goods & Services	Industrial Transportation	Delivery Services	Air Freight & Logistics	E Transportation and Warehousing	Transportation and Warehousing	Private Equity	Venture Capital	35	15-Apr	2015	0.0	
3759	Orios Venture Partners, Mayfield Fund	Crenovative Ideas (TaskBob)	Asia	South Asia	India	IND	IN	Consumer Services	Retail	General Retailers	Specialized Consumer Services	Specialty Retail	Q Wholesale and Retail Trade	Wholesale and Retail Trade	Private Equity	Venture Capital	1	15-Apr	2015	0.0	
3760	SAIF Partners, Accel Partners	UrbanClap Technologies	Asia	South Asia	India	IND	IN	Consumer Services	Media	Media	Media Agencies	Media	N Information	Information	Private Equity	Venture Capital	2	15-Apr	2015	0.0	
3761	ICICI Venture Funds Management	Mytrah Energy	Asia	South Asia	India	IND	IN	Utilities	Utilities	Electricity	Alternative Electricity	Independent Power and Renewable Electricity Producers	V Electric Power	Utilities	Private Credit	Debt	33	15-Apr	2015		
3762	Elevar Equity	Financiera TFC	Latin America	South America	Peru	PER	PE	Financials	Financial Services	Financial Services	Consumer Finance	Consumer Finance	O Finance & Insurance	Finance & Insurance	Private Equity	Growth		15-Apr	2015	0.0	
3763	Aqua Capital	Dimicron	Latin America	South America	Brazil	BRA	BR	Basic Materials	Chemicals	Chemicals	Specialty Chemicals	Chemicals	G Chemicals	Chemicals	Private Equity	Buyout		15-Apr	2015	0.0	
3764	Kaszek Ventures	Love Mondays	Latin America	South America	Brazil	BRA	BR	Consumer Services	Retail	General Retailers	Specialized Consumer Services	Specialty Retail	Q Wholesale and Retail Trade	Wholesale and Retail Trade	Private Equity	Venture Capital		15-Apr	2015	0.0	
3765	Kaszek Ventures	Dress & Go	Latin America	South America	Brazil	BRA	BR	Consumer Services	Retail	General Retailers	Specialty Retailers	Specialty Retail	Q Wholesale and Retail Trade	Wholesale and Retail Trade	Private Equity	Venture Capital		15-Apr	2015	0.0	
3766	Cordiant Capital	SA Taxi	Sub-Saharan Africa	Southern Africa	South Africa	ZAF	ZA	Financials	Financial Services	Financial Services	Consumer Finance	Consumer Finance	O Finance & Insurance	Finance & Insurance	Private Credit	Debt	15	15-Apr	2015		
3767	Tiger Global Management, Lightspeed Venture Partners	Imma Web (LocalOye)	Asia	South Asia	India	IND	IN	Consumer Services	Media	Media	Media Agencies	Media	N Information	Information	Private Equity	Venture Capital	5	15-Apr	2015	0.0	
3768	Shenzhen Green Pine Capital Partners	Beijing Baofeng Mojing Technology	Asia	East Asia	China	CHN	CN	Consumer Goods	Personal & Household Goods	Leisure Goods	Consumer Electronics	Household Durables	M Industrial & Consumer Products	Industrial & Consumer Products	Private Equity	Venture Capital	10	15-Apr	2015	1.0	
3769	East Ventures	Livaza	Asia	Southeast Asia	Indonesia	IDN	ID	Consumer Services	Retail	General Retailers	Specialty Retailers	Specialty Retail	Q Wholesale and Retail Trade	Wholesale and Retail Trade	Private Equity	Venture Capital		15-Apr	2015	0.0	
3770	InFRONTIER	786 Pharma	Asia	South Asia	Afghanistan	AFG	AF	Consumer Services	Retail	Food & Drug Retailers	Drug Retailers	Food & Staples Retailing	Q Wholesale and Retail Trade	Wholesale and Retail Trade	Private Equity	Growth		15-Apr	2015	0.0	
3771	Sequoia Capital	Beijing Tian Heyi Tech (Tiantian Yongche, Ttyongche.com)	Asia	East Asia	China	CHN	CN	Consumer Services	Travel & Leisure	Travel & Leisure	Travel & Tourism	Hotels, Restaurants & Leisure	U Accommodation & Tourism Services	Accommodation & Tourism Services	Private Equity	Venture Capital		15-Apr	2015	0.0	
3772	Northern Light Venture Capital (NLVC)	Xuanke.com	Asia	East Asia	China	CHN	CN	Consumer Services	Retail	General Retailers	Specialized Consumer Services	Specialty Retail	Q Wholesale and Retail Trade	Wholesale and Retail Trade	Private Equity	Venture Capital		15-Apr	2015	0.0	
3773	Tiger Global Management, Ribbit Capital	eTechAces Marketing and Consulting (PolicyBazaar.com)	Asia	South Asia	India	IND	IN	Consumer Services	Retail	General Retailers	Specialized Consumer Services	Specialty Retail	Q Wholesale and Retail Trade	Wholesale and Retail Trade	Private Equity	Venture Capital		15-Apr	2015	0.0	
3774	Accel Partners	Zopnow	Asia	South Asia	India	IND	IN	Consumer Services	Retail	Food & Drug Retailers	Food Retailers & Wholesalers	Food & Staples Retailing	Q Wholesale and Retail Trade	Wholesale and Retail Trade	Private Equity	Venture Capital		15-Apr	2015	0.0	
3775	ALLVP (Venture Partners Mexico)	Medica Santa Carmen	Latin America	Central America	Mexico	MEX	MX	Health Care	Health Care	Health Care Equipment & Services	Health Care Providers	Health Care Providers & Services	S Health Care	Health Care	Private Equity	Venture Capital	7	15-Apr	2015	0.0	
3776	Matrix Partners	Distinct HealthCare	Asia	East Asia	China	CHN	CN	Health Care	Health Care	Health Care Equipment & Services	Health Care Providers	Health Care Providers & Services	S Health Care	Health Care	Private Equity	Venture Capital		15-Apr	2015	0.0	
3777	East Ventures	Otten Coffee	Asia	Southeast Asia	Indonesia	IDN	ID	Consumer Services	Retail	Food & Drug Retailers	Food Retailers & Wholesalers	Food & Staples Retailing	Q Wholesale and Retail Trade	Wholesale and Retail Trade	Private Equity	Venture Capital		15-Apr	2015	0.0	
3778	Practica Capital	TableAir	CEE & CIS	Central & Eastern Europe (CEE)	Lithuania	LTU	LT	Consumer Goods	Personal & Household Goods	Household Goods & Home Construction	Furnishings	Household Durables	M Industrial & Consumer Products	Industrial & Consumer Products	Private Equity	Venture Capital	0.2	15-Apr	2015	0.0	
3779	GGV Capital, IDG Capital Partners (IDGVC), Matrix Partners, Yunqi Partners	Kujiale	Asia	East Asia	China	CHN	CN	Consumer Services	Retail	General Retailers	Home Improvement Retailers	Specialty Retail	Q Wholesale and Retail Trade	Wholesale and Retail Trade	Private Equity	Venture Capital	10	15-Apr	2015	0.0	
3780	East Ventures	WhatWeLike	Asia	Southeast Asia	Indonesia	IDN	ID	Consumer Services	Media	Media	Media Agencies	Media	N Information	Information	Private Equity	Venture Capital		15-Apr	2015	0.0	
3781	Templeton Asset Management (TAML)	Huy Vietnam	Asia	Southeast Asia	Vietnam	VNM	VN	Consumer Services	Travel & Leisure	Travel & Leisure	Restaurants & Bars	Hotels, Restaurants & Leisure	U Accommodation & Tourism Services	Accommodation & Tourism Services	Private Equity	Growth		15-Apr	2015	0.0	
3782	Sequoia Capital	Beijing Shuailai Century Technology (51yongche)	Asia	East Asia	China	CHN	CN	Consumer Services	Retail	General Retailers	Specialized Consumer Services	Specialty Retail	Q Wholesale and Retail Trade	Wholesale and Retail Trade	Private Equity	Venture Capital		15-Apr	2015	0.0	
3783	Sequoia Capital	Zomato	Asia	South Asia	India	IND	IN	Consumer Services	Media	Media	Media Agencies	Media	N Information	Information	Private Equity	Venture Capital		15-Apr	2015	0.0	
3784	Helion Venture Partners, Powerhouse Ventures	Quicko Technosoft Labs (Whatfix)	Asia	South Asia	India	IND	IN	Technology	Technology	Software & Computer Services	Software	Software	R Professional, Scientific and Technical Services	Professional, Scientific and Technical Services	Private Equity	Venture Capital	1	15-Apr	2015	0.0	
3785	Legend Capital, DCM	UCloud Information Technology	Asia	East Asia	China	CHN	CN	Industrials	Industrial Goods & Services	Support Services	Business Support Services	Commercial Services & Supplies	R Professional, Scientific and Technical Services	Professional, Scientific and Technical Services	Private Equity	Venture Capital		15-Apr	2015	0.0	
3786	Sequoia Capital, Kalaari Capital, SAIF Partners	Urban Ladder Home Decor Solutions	Asia	South Asia	India	IND	IN	Consumer Services	Retail	General Retailers	Home Improvement Retailers	Specialty Retail	Q Wholesale and Retail Trade	Wholesale and Retail Trade	Private Equity	Venture Capital	50	15-Apr	2015	0.0	
3787	Mid Europa Partners	Danube Foods Group	CEE & CIS	Central & Eastern Europe (CEE)	Serbia	SRB	RS	Consumer Goods	Food & Beverage	Food Producers	Food Products	Food Products	F Food & Beverages	Food & Beverages	Private Equity	Buyout	192	15-Apr	2015	0.0	
3788	Tsing Capital	iView	Asia	East Asia	China	CHN	CN	Technology	Technology	Software & Computer Services	Computer Services	IT Services	R Professional, Scientific and Technical Services	Professional, Scientific and Technical Services	Private Equity	Venture Capital	7	15-Apr	2015	1.0	
3789	East Ventures, 500 Startups	Blisby	Asia	Southeast Asia	Thailand	THA	TH	Consumer Services	Retail	General Retailers	Specialty Retailers	Specialty Retail	Q Wholesale and Retail Trade	Wholesale and Retail Trade	Private Equity	Venture Capital	0.3	15-Apr	2015	0.0	
3790	Matrix Partners, India Quotient	Purple Squirrel Eduventures	Asia	South Asia	India	IND	IN	Consumer Services	Retail	General Retailers	Specialized Consumer Services	Specialty Retail	Q Wholesale and Retail Trade	Wholesale and Retail Trade	Private Equity	Venture Capital		15-Apr	2015	0.0	
3791	Fanisi Capital	European Foods Africa	Sub-Saharan Africa	East Africa	Kenya	KEN	KE	Consumer Services	Retail	Food & Drug Retailers	Food Retailers & Wholesalers	Food & Staples Retailing	Q Wholesale and Retail Trade	Wholesale and Retail Trade	Private Equity	Growth	2	15-Apr	2015	1.0	
3792	The Abraaj Group, TPG	Kudu	MENA	Middle East	Saudi Arabia	SAU	SA	Consumer Services	Travel & Leisure	Travel & Leisure	Restaurants & Bars	Hotels, Restaurants & Leisure	U Accommodation & Tourism Services	Accommodation & Tourism Services	Private Credit	Debt		15-Apr	2015		
3793	Neulogy Ventures	Eyerim	CEE & CIS	Central & Eastern Europe (CEE)	Slovakia	SVK	SK	Consumer Goods	Personal & Household Goods	Personal Goods	Clothing & Accessories	Textiles, Apparel & Luxury Goods	K Textiles, Apparel & Leather	Textiles, Apparel & Leather	Private Equity	Venture Capital		15-Apr	2015	0.0	
3794	IDG Ventures India, New Enterprise Associates (NEA), SAIF Partners	Brainbees Solutions (Firstcry.com)	Asia	South Asia	India	IND	IN	Consumer Services	Retail	General Retailers	Specialty Retailers	Specialty Retail	Q Wholesale and Retail Trade	Wholesale and Retail Trade	Private Equity	Venture Capital	36	15-Apr	2015	0.0	
3795	New Access Capital, Milestone Capital Management	Lili & Beauty Cosmetics	Asia	East Asia	China	CHN	CN	Consumer Goods	Personal & Household Goods	Personal Goods	Personal Products	Textiles, Apparel & Luxury Goods	M Industrial & Consumer Products	Industrial & Consumer Products	Private Equity	Venture Capital	100	15-Apr	2015	0.0	
3796	BlueRun Ventures, Source Code Capital	Beijing Kuaile Shidai Technology Development (Qufenqi.com)	Asia	East Asia	China	CHN	CN	Consumer Services	Retail	General Retailers	Broadline Retailers	Specialty Retail	Q Wholesale and Retail Trade	Wholesale and Retail Trade	Private Equity	Venture Capital	50	15-Apr	2015	0.0	
3797	Templeton Asset Management (TAML)	Defacto Perakende Ticaret	CEE & CIS	Central & Eastern Europe (CEE)	Turkey	TUR	TR	Consumer Services	Retail	General Retailers	Apparel Retailers	Specialty Retail	Q Wholesale and Retail Trade	Wholesale and Retail Trade	Private Equity	Growth		15-Apr	2015	0.0	
3798	Sequoia Capital	MobiKwik	Asia	South Asia	India	IND	IN	Financials	Financial Services	Financial Services	Consumer Finance	Consumer Finance	O Finance & Insurance	Finance & Insurance	Private Equity	Venture Capital		15-Apr	2015	0.0	
3799	Tiger Global Management	Quikr	Asia	South Asia	India	IND	IN	Consumer Services	Media	Media	Media Agencies	Media	N Information	Information	Private Equity	Growth		15-Apr	2015	0.0	
3800	Omnivore Capital Management Advisors	Ecozen Solutions	Asia	South Asia	India	IND	IN	Industrials	Industrial Goods & Services	Industrial Engineering	Industrial Machinery	Machinery	M Industrial & Consumer Products	Industrial & Consumer Products	Private Equity	Venture Capital	1	15-Apr	2015	0.0	
3801	Sequoia Capital	PressPlay	Asia	South Asia	India	IND	IN	Consumer Services	Media	Media	Broadcasting & Entertainment	Media	N Information	Information	Private Equity	Venture Capital	2	15-Apr	2015	0.0	
3802	SAIF Partners, Accel Partners	Bundl Technologies (Swiggy)	Asia	South Asia	India	IND	IN	Consumer Services	Retail	General Retailers	Specialized Consumer Services	Specialty Retail	Q Wholesale and Retail Trade	Wholesale and Retail Trade	Private Equity	Venture Capital	2	15-Apr	2015	0.0	
